Date;N° HESSO;Date de début;Date de fin;Libellé;Statut
2013-10-25;35617;2012-10-01;2012-12-17;Swiss longitudinal retrospective cohort study of nurses' career paths and retention (n@w);AC
2015-05-26;35618;2013-01-02;2014-07-31;CacHing Optimization In Cloud infrastructurE ;AC
2014-08-19;35619;2013-01-01;2013-12-31;Impact des boissons sucrées sur la santé;AC
2015-05-04;35672;2013-01-01;2014-03-31;Impact de l'activité physique sur les capacités à effecuter les ADL de la personne âgée modérément à sévèrement démente, hospitalisée en soins aigus. Intérêt de l'inclusion d'un 5è centre psycho-gériatrique en Belgique;AC
2015-05-21;35676;2013-02-01;2014-08-30;Micro Fermentation System;AC
2015-05-18;35691;2013-01-01;2014-01-31;Ubiquous portable Scanning Laser Ophthalmoscope;AC
2014-01-21;35829;2012-01-09;2014-01-31;Valorisation domaine : ouvrage scientifique suite à la recherche « Le travail réel des directions d'institutions scolaires et sociales »  ;EC
2015-05-07;35832;2013-03-01;2014-09-30;Design d'une liaison Ethernet sur fibre optique 10Giga;AC
2014-12-05;35850;2013-01-01;2013-06-30;FIRMENICH_2013  ;AC
2015-04-30;35931;2013-05-22;2014-11-30;Platform for Ubiquitous Smart Systems for Embedded Recording of Events;AC
2015-04-30;35932;2013-02-01;2014-11-30;Platform for Ubiquitous Smart Systems for Embedded Recording of Events;AC
2013-12-08;35939;2012-06-01;2013-10-31;TOSA Structure;AC
2013-02-04;35944;2012-02-01;2014-01-31;Operational test of an osmotic pipe for passive irrigation with sea or sewage water. Afflow Irrigation Technology from Dupont;RF
2015-05-07;36051;2012-12-01;2014-11-01;GlobalDiagNostiX MACHOP;AC
2015-05-28;36057;2013-05-01;2014-02-01;PIMSTIM, Fabrication and testing of a combined direct-STIM and proton-induced fluorescence instrument    ;AC
2013-09-09;36059;2012-01-01;2013-02-07;Publication (soutien fonds de promotion à l'égalité des chances) : Articuler diversité et genre:un défi pour les hautes écoles;AC
2015-04-22;36062;2013-01-01;2014-06-30;In vitro models for toxicity assessement.;AC
2014-05-07;36064;2013-01-01;2013-12-31;Cofin institut inIT 2013;AC
2014-05-07;36070;2013-01-01;2013-12-31;Cofinancement institut inPACT 2013;AC
2013-12-05;36102;2012-10-01;2013-12-31;Conception et mise en oeuvre sous la forme d'un progiciel d'une méthodologie de mise en place d'un système de mesurage du SMSI conforme à la norme ISO 27004;RF
2014-10-27;36103;2013-09-01;2016-09-30;Innovation and Common Knowledge Space in Airport Ground Movement Optimisation and Robustness;RF
2014-01-13;36107;2014-01-06;2015-06-30;Calliope.ch : Offre numérique en bibliothèque : contenus, organisation de l'offre, terminaux de lecture et usages. Etude de cas en Suisse romande.;EC
2014-12-16;36203;2012-06-01;2013-06-01;Projet d'imagerie diagnostique appropriée: GlobalDiagnostiX;AC
2014-06-02;36245;2012-10-15;2013-01-30;Dilemmes et questionnements dans l'activité quotidienne des professionnels auprès de personnes démentes en institution;AC
2013-03-08;36248;2013-03-08;2020-12-31;Fondation Naef pour la recherche in vitro.;EC
2014-03-26;36282;2013-02-01;2016-01-31;FNS - Division Coopération Internationale 2012 :"Romanian Ageing migrants and the Welfare State"  Décision FNS no IZERZ0_142219/1;EC
2015-08-28;36283;2012-03-01;2014-02-28;Projet externe 2013 Caisse nationale des allocations familiales (CNAF) "Les normes de parentalité: production et réception des normes";AC
2015-02-19;36322;2013-03-01;2013-12-31;LiveInYourHead-Expositions 2009-2013;EC
2015-02-19;36323;2013-03-01;2014-01-31;Trois expositions, un symposium et des publications autour du projet Art, Science,   Counterculture : Perspective on A Radical Enlightenment ARE;EC
2014-04-07;36327;2013-03-01;2013-12-31;Projet externe 2012 : L'approche de la résilience dans la prise en charge psychosociale des enfants et jeunes en situation difficile en Côte d'Ivoire;AC
2013-11-14;36328;2012-06-01;2016-05-31;Security requirement Analysis oRiented towArds the Human;RF
2015-09-24;36341;2014-01-01;2016-11-01;Solution intégrée de comptabilité de gestion simplifiée pour PME (SICS);EC
2013-12-09;36381;2013-03-17;2013-05-30;Evaluations finale du projet "Programme transfrontalier de conservation et de gestion durable des écosystèmes sahariens de la région du Termit, Niger et de l'Egueï, Tchad"(Projet Antilopes Sahélo Sahariennes - ASS)  ;AC
2014-12-13;36386;2013-01-01;2013-12-31;Cofinancement institut inSTI 2013;AC
2014-12-13;36445;2013-01-01;2013-12-31;Cofin inTNE 2013;AC
2015-07-14;36446;2013-04-01;2015-06-30;Contribution à la conception et au développement du système emCloud;AC
2015-09-01;36468;2012-03-01;2013-09-02;L'essai au risque du cinéma et de l'art contemporain : généalogie et état des lieux;AC
2015-07-01;36474;2013-04-01;2014-07-31;Tooxme Reinventing Mobility;AC
2013-10-15;36530;2013-02-08;2013-10-15;"Gestion aministrative" et "Accueil et prestation" des cuisines scolaires.;AC
2014-06-02;36555;2012-06-18;2013-03-28;Sensory-motor deficits in patients with an ankle sprain and its consequences on sport and daily life activities;AC
2014-01-31;36659;2012-03-01;2014-02-28;Biometrics Evaluation and Testing (BEAT);AC
2015-06-01;36660;2014-04-01;2015-03-31;GlobalDiagnostiX: Un système d'imagerie diagnostique approprié au contexte des pays en voie de développement;TS
2015-09-24;36720;2014-01-06;2015-06-30;Market Access Companion;TA
2014-11-26;36727;2012-09-01;2015-12-31;Etude de la gestion quantitative et des débits du Rhône en période de "basses eaux"  ;EC
2013-12-17;36735;2013-01-01;2030-12-31;Recherche Plantations Urbaines  ;EC
2015-03-06;36746;2013-01-01;2015-06-30;Maison de la Rivière 2013.;AC
2013-11-12;36773;2013-10-01;2015-09-30;Swiss longitudinal retrospective cohort study of nurses' career path and retention;EC
2013-10-22;36797;2013-09-01;2016-08-31;Organizing, Communicating, and Costing in Risk Governance : Learning Lessons from the H1N1 Pandemic;EC
2013-12-09;36921;2013-04-15;2013-06-14;Sheet Resistance Measurement Unit  ;AC
2014-01-09;36947;2012-09-01;2013-09-30;Pince robotique pour le nettoyage de débris spatiaux en orbite autour de la terre  ;AC
2014-05-30;36973;2013-05-01;2013-12-31;Conception, développement et support des technologies clouds `open source' orientées multimédia;AC
2013-12-05;36983;2013-09-01;2014-08-31;Sécurisation de l'administration des médicaments aux patients et suivi de l'observance thérapeutique par l'intermédiaire d'une application mobile.;RF
2013-05-22;37016;2013-05-01;2013-10-31;Conception, développement et support des technologies clouds `open source' orientées multimédia  ;AC
2013-05-30;37054;2013-05-30;2013-05-30;L'essai au risque du cinéma et de l'art contemporain : généalogie et état des lieux;RF
2013-05-30;37055;2012-03-01;2013-09-02;L'essai au risque du cinéma et de l'art contemporain : généalogie et état des lieux;AN
2013-09-16;37060;2013-09-01;2016-09-30;Structure Degradation Evaluation for environmental Legislation  ;EC
2015-11-02;37073;2013-05-01;2015-12-31;ESPACE Arve & Rhône  ;TS
2014-11-10;37095;2013-02-28;2014-06-30;EXITFLEX CTI : Analyse de l'écoulement dans une buse de pulvérisation de liquide;AC
2013-09-20;37216;2013-10-01;2016-02-29;Ecological Waste Management;EC
2015-01-27;37219;2013-06-10;2015-06-30;Concevoir et réaliser une application - Share;EC
2013-11-15;37236;2013-09-02;2016-09-02;Ecological Waste Collection;AN
2013-09-16;37237;2013-03-22;2013-04-30;Réalisation d'un inventaire et un benchmark des programmes d'encouragement aux économies d'énergie similaires existants pour les clients PME-I;AC
2014-11-07;37241;2013-04-01;2014-01-31;Projet interne CEDIC:"Patients migrant(es) sans statut légal en consultation dans un cabinet de physiothérapie à la Heds"  ;AC
2015-09-28;37301;2013-11-01;2015-04-30;Novel forecasting tools for very large scale time series systems;TA
2015-10-28;37304;2013-11-01;2015-08-31;Fashioning Movement;EC
2015-11-03;37371;2013-06-30;2014-12-31;ValDech : Production d'hydrocarbures à partir de déchets. Etude de faisabilité.  ;AC
2013-11-29;37382;2013-02-25;2013-10-31;Audit gestion es risques cour des comptes VD;AC
2013-06-24;37397;2010-10-01;2012-12-31;Multi-Site ARC services;AC
2013-12-17;37424;2013-03-01;2013-06-30;Accompagnement comité Direction du Genève Tourisme & Congrès (GT&C);AC
2014-07-09;37425;2013-03-01;2013-06-30;Mise en place d'une gestion des risques pour l'Office Cantonale des Assurances Sociales (OCAS) - partie 1;AC
2014-10-21;37473;2013-01-01;2015-12-31;Distributed Secure Processing for Enhanced Speech in Wireless Sensor Networks;RF
2014-09-04;37475;2013-05-01;2014-07-31;Swiss Academic Cloud;AC
2015-07-08;37527;2013-09-01;2015-12-31;Un service Web pour un simulateur de fluides hébergé dans le Cloud / A Web Service for a Cloud-based Fluid Simulator;EC
2014-10-27;37547;2013-09-01;2015-08-31;Airport Innovative and Robust Solutions in Ground  Movement Optimisation;RF
2014-06-02;37613;2013-03-07;2013-05-30;Impact of mode of delivery on the physical and psychological health of first-time parents;AC
2014-06-02;37614;2013-04-10;2013-05-30;Improving adolescent's eating habits through environmental interventions;AC
2014-12-16;37616;2013-09-01;2016-09-30;Gestion durable de la qualité des eaux de surface en milieu agricole et conséquences écologiques pour les cours d'eau.;EC
2015-07-17;37652;2013-06-10;2015-03-31;the present project will examine the influence of hip abductor fatigue of healthy volunteers aged 18 to 40 on kinematics and kinetics of the lower extremity at the moment of the landing after a single leg forward jump and sidestep cutting maneuver.;AC
2015-01-06;37662;2013-07-08;2014-12-31;Banque de données du logement - étape 2;AC
2015-07-24;37679;2013-07-01;2015-03-31;Dispositifs nanostructurés pour la régénération neuronale  ;TA
2015-07-07;37683;2014-03-01;2015-12-31;Novel inspection device for accurate assessment of critical defects such as fatigue and stress corrosion cracking (Integrated Circuit Hall Sensor Array (ICHSA) for NDT phase II)  ;EC
2014-10-27;37765;2014-01-31;2017-12-31;Public administration peer-empowered through holistic technology enhanced learning;RF
2013-12-27;37806;2013-09-01;2014-11-30;WIDD: Web Intelligence for Drug Development;RF
2013-12-27;37810;2013-12-01;2016-11-30;Web Intelligence for Rare Disease;RF
2013-12-09;37889;2013-11-11;2015-04-30;Clean Water Monitoring (I2_2013_009);RF
2013-11-18;37892;2013-11-25;2015-09-30;Wikinomics - Fostering collaborative key-competences for employability through free-licensing & wiki methodologies;EC
2014-12-03;37929;2013-05-01;2015-12-31;ESPACE Arve & Rhône _ SEUJET  ;AC
2013-11-28;37933;2014-01-01;2016-12-31;OI-Net, European Academic Network for Open Innovation;EC
2014-11-26;37976;2013-06-01;2015-12-31;Suivi des impacts de la vidange du barrage de Verbois : aspects piscicoles  ;EC
2014-11-11;38114;2014-05-01;2020-04-30;Engine for Question Answering in Agriculture;RF
2014-11-07;38116;2012-06-18;2013-01-18;Prescribing nutrition support in critically ill children;AC
2015-01-14;38243;2013-01-01;2014-12-31;Valorisation domaine : écriture d'un ouvrage scientifique en vue de sa publication intitulé "Réconciliation et citoyenneté démocratique au Rwanda" no TS-CR-09-13;TS
2015-04-13;38255;2013-10-01;2014-09-30;AltruIS, réseau social d'engagements comme outil de mesure de son engagement social;TS
2015-06-29;38275;2014-01-05;2015-03-31;Jumping and Injuries: the role of hip abductor strength;TS
2014-01-09;38277;2013-11-01;2015-04-30;"Multifunctional BIOcompatible surfaces due to tailored COATings";AN
2014-10-22;38297;2013-10-01;2014-01-31;Conception et mise en application d'une arborescence classificatoire au sein du SME;AC
2015-07-01;38351;2013-11-01;2015-10-31;ETF kit 2;AC
2014-05-09;38352;2013-01-01;2013-12-31;SOCLE SITE 2013-filière travail social;AC
2015-06-08;38385;2014-01-01;2014-10-31;Cost ' effectiveness of physical therapy interventions: a systematic review;AN
2014-11-07;38453;2014-03-01;2015-12-01;Conception et développement d'une application pour Smartphone destinée à lister la consommation alimentaire;EC
2015-10-08;38454;2014-04-01;2015-03-31;Bourse de relève du domaine TS Eva Nada "En attendant une place d'apprentissage, la prise en charge des jeunes peu qualifiés par l'assurance chômage en Suisse";TS
2015-01-29;38455;2013-09-30;2014-03-17;Enquête sur la perception de la forêt par les genevois;AC
2015-10-22;38456;2013-09-01;2015-12-31;Projet subvention pour FP7 - P. Ruch;EC
2015-10-22;38457;2013-09-01;2015-12-31;Projet subvention pour FP7 - D. Billard;EC
2014-11-07;38462;2014-04-01;2015-04-01;Impact de l'utilisation de la simulation avec patients standardisés vs. des jeux de rôles sur les compétences communicationnelles des étudiants en santé : un essai contrôlé randomisé;AC
2015-09-14;38463;2013-09-01;2015-12-31;Projet subvention pour FP7 - S. Emad;EC
2015-10-22;38464;2013-09-01;2015-12-31;Projet subvention pour FP7 - JPTrabichet;EC
2015-09-14;38465;2013-09-01;2015-12-31;Subvention pour FP7 - A. Kalousis;EC
2015-01-12;38492;2014-10-01;2016-09-30;Projet interne octobre 2013 "l'attribution d'aide  financière aux personnes surendettées. Une analyse sociologique de l'intervention des assistantes sociales et des assistants sociaux"-TS-RAD13-03;EC
2014-01-09;38514;2014-01-01;2014-01-01;Mesures expérimentales aux seins de mécanismes horlogers;RF
2015-09-23;38537;2013-06-01;2015-05-31;Head Mounted Display;TA
2014-07-29;38578;2013-10-16;2014-04-30;Ecoulement à la bouche d'entrée d'un dispositif d'aspiration de débrits 2.  ;AC
2014-01-22;38597;2014-01-01;2016-12-31;Biodiversité alpine menacée par le réchauffement climatique : pour une stratégie de conservation proactive et de valorisation durable des mares et étangs dans les Alpes suisses.  ;EC
2015-02-20;38602;2013-08-02;2013-10-11;Development of the Strategy for a Field of Action;AC
2015-10-20;38619;2014-07-01;2016-06-30;Projet CTI : Usinage par EDM de matériaux à faible conductivité et à haute valeur ajoutée, par l'utilisation d'un générateur à large plage de fonctionnement en tension, permettant également des régimes de finition de type ECM   ;EC
2015-10-14;38643;2013-10-01;2016-12-31;Clé d'identification des groupements végétaux de Suisse  ;EC
2015-02-04;38678;2013-11-01;2014-03-31;Territoires;RF
2015-04-23;38681;2014-01-01;2014-12-31;RODIN IV - 2014;AC
2015-06-17;38684;2014-01-01;2014-12-31;ACCEPT IV - 2014;AC
2015-10-13;38818;2013-10-01;2015-05-31;Lebensbedingungen und Handlungsansätze von Bauernhaushalten in schwierigen Situationen;TS
2015-04-22;38824;2014-04-01;2014-12-31;In vitro models for toxicity assessment  ;AC
2015-01-13;38880;2013-06-01;2016-05-01;Autonomous Knowledge Discovery;RF
2014-01-21;38881;2013-11-01;2015-10-31;A Microfluidic in-vitro perfusion-cell for radiooncological pharmaceutical testing;EC
2013-11-18;38882;2013-04-01;2015-03-31;Personalized Advertisements and Content for the Web;RF
2013-11-18;38883;2013-04-01;2016-03-31;Women and Men Lifestyle Intervention StratEgy ACTion ;RF
2014-04-03;38884;2013-11-01;2013-12-31;Bioalps;AC
2013-11-18;38961;2013-01-01;2013-12-31;Knowledge Discovery in Data and Knowledge Intensive Domains and High Dimensionality Small Sample settings;RF
2014-11-11;38962;2013-01-01;2015-12-31;Scientific Knowledge Discovery in Data and Knowledge Intensive;RF
2014-11-11;38964;2013-09-01;2015-08-31;Diversity regularizers for alternative model learning and ensemble learning;RF
2014-02-06;38967;2012-11-29;2013-05-28;Projet insertion du REAP 2012-2013-projet de 3 manifestations sur le thème de l'insertion. les 29 novembre 2012-7 février 2013 et 28 mai 2013;AC
2014-11-21;38969;2013-11-21;2014-05-15;Les jeudis de la filière Psychomotricité 2013-2014 ;AC
2015-04-02;38976;2014-01-01;2014-03-31;Simulation numérique de l'interaction jet d'eau haute pression-pneu  ;AC
2014-12-04;38983;2013-11-01;2014-02-28;Traitement du linge personnel des personnes âgées : étude de marché et de la valeur perçue;AC
2014-11-11;39023;2013-10-01;2016-09-30;Data-driven computer simulation of pathological gait resulting from contractures;EC
2013-12-09;39038;2014-01-01;2014-06-30;Info-Net Economy IV - Projet E-lib.ch ;EC
2015-02-11;39058;2013-04-23;2013-04-25;Promotion du domaine TS-Problèmes publics de la rue - Sans-abrisme, intervention sociale et gouvernement de la ville;AC
2015-10-28;39062;2014-03-01;2016-03-31;Cloud Based Design Support System for Urban Numeric Data;EC
2015-10-07;39070;2014-01-01;2015-10-31;Amélioration de la Zone Thermiquement affectée par LASER à impulsion courte ou electo-erosion.;EC
2014-04-03;39073;2013-11-01;2014-10-31;Sustainable Engineering Network (I5-2013-36).;AC
2014-06-13;39085;2014-01-01;2015-12-31;Mise en oeuvre de surfaces végétalisées adaptées aux changements climatiques en milieu urbain dense.  ;EC
2013-11-28;39103;2013-07-01;2015-12-31;Portail web de cartographie historique sur le Grand Genève;EC
2014-08-25;39117;2013-06-01;2014-12-31;Recherche d'un positionnement commun des PNR de l'Arc jurassien ;AC
2015-03-12;39119;2013-11-01;2015-06-30;Ferme de Budé;AC
2013-11-29;39136;2013-03-01;2015-12-31;Expérimentation 'Débit réservé' en Moyenne-Durance : réponses des communautés biologiques aux nouvelles modalités de gestion des débits au voisinage des ouvrages hydro-électriques  ;EC
2015-09-01;39145;2013-12-01;2014-03-31;OUTSIDER / INSIDER  Transformations systémiques de la création contemporaine;TA
2015-06-08;39146;2015-06-01;2017-06-30;Drill the brain through music or walking, impact of different training regimens on  age-induced cognitive decline;RF
2015-03-06;39147;2015-03-31;2015-07-17;Vitrage nanotec ' Des solutions nano pour contrôler les flux énergétiques à travers les vitres ainsi que pour améliorer leurs propriétés de surface tout en assurant leur transparence optique ;EC
2014-12-03;39152;2013-11-01;2013-12-31;Plante et cité Suisse (I5-2013-30);AC
2015-10-13;39160;2014-03-01;2015-06-30;Bourse de relève du domaine TS M. Andrès Gomensoro "le parcours éducatif des descendants d'immigrés en Suisse. Le cas des enfants d'immigrés albanophones d'Ex-Yougoslavie";TS
2014-10-16;39161;2013-06-13;2014-01-31;Contribution à l'étude du projet de renouvellement et d'extension de la vidéosurveillance sur les sites du SIS Genève;AC
2014-02-10;39163;2013-12-01;2015-11-30;Projet int. domaine TS : "Education supérieure, développement de compétences et opportunités d'insertion de jeunes femmes défavorisées en zone urbaine indienne";AC
2015-11-02;39165;2014-02-01;2015-10-31;Cloud computing for InTernet of Things Infrastructure;TS
2014-11-21;39166;2014-01-01;2016-03-31;"Development of technology building blocks for hte microengineering with long term sensing of tissues   cellular barrier function and structure"  ;EC
2014-11-21;39168;2014-01-01;2016-03-31;Development of technology building blocks for miniaturized label free biomarker detectors  ;EC
2015-06-08;39169;2015-06-01;2017-06-30;SimiX ' Simulating X-Ray images: From training to computer-assisted medicine;RF
2015-03-27;39170;2013-11-01;2013-12-31;Brenet (I5-2013-23);AC
2015-07-08;39172;2014-04-01;2015-11-30;Enveloppes solaires urbaines - valorisation du potentiel solaire actif des façades des bâtiments en milieu urbain.;EC
2014-02-14;39174;2014-01-01;2016-12-31;Végétal en Ville;EC
2014-07-02;39177;2014-01-01;2015-03-31;"Micro-usinage et polissage par ECM de matériaux à faible conductivité et à haute-valeur ajoutée,   par l'utilisation d'une source de tension et générateur adaptés."  ;RF
2015-11-03;39186;2013-11-01;2015-12-31;Diagnostic Biochips 2013   ;TA
2014-04-17;39191;2013-01-01;2013-06-30;forfait du domaine TS pour la préparation du projet externe FNS : "l'attribution d'aide  financière aux personnes surendettées. Une analyse sociologique de l'intervention des assistantes sociales et des assistants sociaux de Suisse Romande"   no TS-CR-18-;AC
2014-04-17;39193;2013-01-01;2013-06-30;forfait du domaine TS pour la préparation du projet externe FNS : "La construction de la dépendance au jeu comme problème de santé publique. Genèse  et usage d'une nouvelle catégorie médicale" no TS-CR-82-13;AC
2015-07-21;39195;2013-07-01;2014-12-31;Façades végétales démonstrateur;TA
2015-10-16;39198;2013-12-01;2015-06-30;Centre de compétences transfrontalier pour la planification et le suivi des quartiers durables;TA
2014-04-17;39199;2013-01-01;2013-06-30;forfait du domaine TS pour la préparation du projet externe FNS : "Citizenship as capabilities:the role of conversion factors for the inclusion of marginalized youth"   no TS-CR-24-13;AC
2014-04-17;39211;2013-01-01;2013-06-30;forfait du domaine TS pour la préparation du projet externe FNS : "The school environment and sense of belonging (Morocco, Saharan and pre-Saharan  region): an architectural project for an open and engaging school"  no TS-CR-17-13;AC
2015-09-23;39212;2013-11-01;2015-12-31;La nature au bénéfice de la ville et la ville au bénéfice de la nature.  ;EC
2015-06-23;39241;2013-10-01;2016-05-31;Evaluation de populations de cerfs par pièges photographiques  ;EC
2014-04-17;39256;2012-09-01;2012-12-31;forfait du domaine TS pour la préparation du projet externe FNS : "Formation des valeurs dans l'activité et construction de la professionnalité des éducateurs spécialisés" no TS-CR-19-13;AC
2014-03-11;39266;2014-04-01;2015-03-31;Application mobile "pilulier intelligent" permettant de sécuriser l'administration des médicaments au patient et d'effectuer le suivi de l'observance thérapeutique.;EC
2015-10-13;39272;2014-02-28;2016-02-28;Valorisation domaine TS de la recherche "la réflexivité dans l'activité des travailleurs sociaux:enjeux pour la professionnalisation" pour l'écriture d'un ouvrage scientifique en vue de sa publication auprès des Editions ies no TS-CR-21-13;TS
2014-06-16;39276;2013-09-01;2014-12-31;Valorisation domaine TS pour l'édition du livre : "L'ajustement dans tous ses états. Règles, émotions, distance et engagement dans les activités éducatives d'un centre de jour" no TS-CR-22-13 ;AC
2015-10-29;39335;2014-01-06;2015-09-30;Agrégation de charges flexibles.;TA
2015-10-22;39336;2013-09-01;2015-12-31;Projet subvention pour FP7 - S. Varone;EC
2015-04-09;39337;2014-01-01;2015-03-31;Flexible, cloud-based key opinion leader identification solution;AC
2014-04-17;39339;2012-10-01;2013-03-31;forfait du domaine TS pour la préparation du projet externe FNS : "L'accompagnement des artistes singuliers : quelles pratiques, quels enjeux et quelles perspectives ? Enquête menée au sein du réseau des acteurs romands qui interviennent directement et in;AC
2014-04-28;39340;2014-06-01;2015-11-30;SNIS - « Children of refugees in Europe : aspirations, social and economic lives, identity and transnational linkages »;EC
2014-04-17;39341;2012-07-01;2012-12-31;forfait du domaine TS pour la préparation du projet externe déposé auprès de la Fondation Leenaards : "Dilemmes et questionnements dans l'activité quotidienne des soignants auprès de personnes démentes en institution : Comment faire exister et maintenir a;AC
2014-04-17;39342;2012-10-01;2013-03-31;forfait du domaine TS pour la préparation du projet externe FNS : "Le pouvoir expérientiel du langage au service de la qualité des pratiques dans le champ de la protection de l'enfance" (division I), dépôt avril 2013. no TS-CR-16-13 ;AC
2015-04-23;39401;2014-09-01;2016-08-31;Création d'une infrastructure Linked Open Data Genevoise pour les Bibliothèques de la ville;EC
2014-04-17;39410;2013-01-01;2013-12-31;Valorisation domaine TS pour l'édition du livre : "La part sensible de l'acte. Présence au quotidien en éducation sociale" no TS-CR-11-13;AC
2014-12-03;39411;2013-11-07;2013-12-31;Projet d'évolution de la ferme et du parc de Budé  ;AC
2015-05-28;39412;2014-01-01;2014-12-31;inPACT - acquisition et valorisation de projets 2014;AC
2015-05-28;39413;2014-01-01;2014-12-31;inIT : Acquisition et valorisation de projets 2014;AC
2015-05-06;39414;2014-01-01;2014-12-31;Acquisition et valorisation inSTI 2014.;AC
2015-05-12;39415;2014-01-01;2014-12-31;Acquisition et valorisation inTNE 2014.;AC
2014-04-17;39438;2013-01-01;2013-05-31;forfait du domaine TS pour la préparation du projet : "Déterminants sociaux et sanitaires de l'alimentation des accouchées. Pour une approche intégrée de santé maternelle en milieu rural akan de Côte d'Ivoire" no TS-CR-80-13;AC
2015-10-26;39440;2013-01-01;2013-12-31;Valorisation domaine TS pour la traduction d'un article scientifique : "Ethnography of a Political Ritual:Discourses of Authorities to New Swiss Citizens" no TS-CR-35-13;AC
2015-02-04;39458;2013-12-01;2014-03-31;Signalisation, signalétique : les défis de la digitalisation;RF
2014-07-14;39477;2014-02-01;2015-10-31;RSD GLASS Infonomics;EC
2015-09-23;39478;2013-01-01;2014-12-31;Mulch liquide  ;TA
2015-09-04;39480;2014-01-01;2015-06-30;Establishing a promising 'Quicktest' for food-borne microbial enterotoxins SE,  serving to trace safety risks in the food chain   ;TA
2014-01-29;39501;2013-05-01;2013-12-31;Projet de recherche en analyse de l'activité dans le secteur de la petite enfance de la commune de Vernier en 2013-"Travail d'intégration à l'oeuvre dans l'activité des éducateurs-trices de l'enfance de la Commune de Vernier";AC
2015-05-21;39503;2013-12-01;2016-04-30;Evaluation des comportements des ongulés face aux réflécteurs d'avertissement routiers  ;EC
2014-02-28;39615;2013-02-01;2013-10-03;Enquête des habitants de l'arc lémanique, Forum 2013 "Et maintenant ?";AC
2015-09-17;39736;2013-12-01;2015-02-28;E'criture mobile: Contenus modulaires sur supports e'lectroniques  ;EC
